,song_id,song_name,date_time_played,lyrics
0,42YNobZ4HN3tRVEA47wLT6,When I'm Gone,2021-08-03T13:13:20.649Z,"Intro
Yeah, it's my life
In my own words, I guess

Verse 1
Have you ever loved someone so much, you'd give an arm for?
Not the expression, no, literally give an arm for
When they know they're your heart and you know you are their armor
And you will destroy anyone who would try to harm her
But what happens when karma turns right around to bite you?
And everything you stand for turns on you to spite you?
What happens when you become the main source of her pain?
""Daddy, look what I made!"" ""Dad's gotta go catch a plane""
""Daddy, where's Mommy? I can't find Mommy, where is she?""
""I don't know, go play, Hailie, baby, your daddy's busy
Daddy's writin' a song, this song ain't gon' write itself
I'll give you one underdog, then you gotta swing by yourself""
Then turn right around on that song and tell her you love her
And put hands on her mother who's a spitting image of her
That's Slim Shady, yeah, baby, Slim Shady's crazy
Shady made me, but tonight Shady's rock-a-bye baby, ha

Chorus
And when I'm gone, just carry on, don't mourn, rejoice
Every time you hear the sound of my voice, just know that
I'm lookin' down on you smilin' and I didn't feel a thing
So, baby, don't feel my pain, just smile back
And when I'm gone, just carry on, don't mourn, rejoice
Every time you hear the sound of my voice, just know that
I'm lookin' down on you smilin' and I didn't feel a thing
So, baby, don't feel my pain, just smile back

Verse 2
I keep havin' this dream, I'm pushin' Hailie on the swing
She keeps screamin' she don't want me to sing
""You're makin' Mommy cry, why? Why is Mommy cryin'?""
""Baby, Daddy ain't leavin' no more"" ""Daddy, you're lyin'!
You always say that, you always say this is the last time
But you ain't leavin' no more, Daddy, you're mine!""
She's pilin' boxes in front of the door, tryna block it
""Daddy, please! Daddy, don't leave! Daddy, no, stop it!""
Goes in her pocket, pulls out a tiny necklace locket
It's got a picture, ""This'll keep you safe, Daddy, take it with ya!""
I look up, it's just me standin' in the mirror
These fuckin' walls must be talkin', 'cause man, I can hear 'em
They're sayin', ""You got one more chance to do right and it's tonight
Now go out there and show 'em that you love 'em 'fore it's too late!""
And just as I go to walk out of my bedroom door
It turns to a stage, they're gone and this spotlight is on and I'm singin'

Chorus
And when I'm gone, just carry on, don't mourn, rejoice
Every time you hear the sound of my voice, just know that
I'm lookin' down on you smilin' and I didn't feel a thing
So, baby, don't feel my pain, just smile back
And when I'm gone, just carry on, don't mourn, rejoice
Every time you hear the sound of my voice, just know that
I'm lookin' down on you smilin' and I didn't feel a thing
So, baby, don't feel my pain, just smile back

Verse 3
Sixty-thousand people all jumpin' out their seat
The curtain closes, they're throwin' roses at my feet
I take a bow and ""Thank you all for comin' out""
They're screamin' so loud, I take one last look at the crowd
I glance down, I don't believe what I'm seein'
""Daddy, it's me! Help Mommy, her wrists are bleedin'!""
""But baby, we're in Sweden, how did you get to Sweden?""
""I followed you, Daddy, you told me that you weren't leavin'
You lied to me, Dad, and now you made Mommy sad
And I bought you this coin, it says 'Number One Dad'
That's all I wanted, I just wanna give you this coin
I get the point, fine, me and Mommy are goin'.""
""But baby, wait!"" – ""It's too late, Dad, you made the choice
Now go up there and show 'em that you love 'em more than us
That's what they want, they want you, Marshall, they keep
Screamin' your name, it's no wonder you can't go to sleep
Just take another pill, yeah, I bet you you will
You rap about it, yeah, word, k-keep it real.""
I hear applause, all this time I couldn't see
How could it be that the curtain is closin' on me?
I turn around, find a gun on the ground, cock it
Put it to my brain, scream, ""Die, Shady!"" and pop it
The sky darkens, my life flashes, the plane that I was
Supposed to be on crashes and burns to ashes
That's when I wake up, alarm clock's ringin', there's birds singin'
It's spring and Hailie's outside swingin'
I walk right up to Kim and kiss her, tell her I miss her
Hailie just smiles, and winks at her little sister, almost as if to say

Chorus
And when I'm gone, just carry on, don't mourn, rejoice
Every time you hear the sound of my voice, just know that
I'm lookin' down on you smilin' and I didn't feel a thing
So, baby, don't feel my pain, just smile back
And when I'm gone, just carry on, don't mourn, rejoice
Every time you hear the sound of my voice, just know that
I'm lookin' down on you smilin' and I didn't feel a thing
So, baby, don't feel my pain, just smile back

*Curtains closing"
1,1jlnBQGP2DtSEhMgQaz7a7,Haute (feat. J Balvin & Chris Brown),2021-08-03T12:58:47.598Z,"Intro: Tyga
Make it hot, yeah
Make it hot

Verse 1: Tyga
I've been up four days, havin' three-ways (Yeah)
Like my bitches in twos, I'm the one, man (One)
Tryna jump in my lane, I'm in the air, man (Woo)
Make her fall in love, she gon' want the last name (Hah)
I'm a giant to these niggas like San Fran (Woah)
And this beat slap, nigga, like a backhand (Woah)
I know you wanna fuck a rapper, you a rap fan
How you just glowed up like Pac-Man? (Man)
I get it, you got bands (Yeah, yeah)
Make your own money, make a nigga spend his whole advance (Woah)
If I hit once, then I know I can hit it again (Yeah)
T-shirt and your panties on, baby, you know what it is

Chorus: Tyga, Chris Brown & J Balvin
I make it hot (Yeah, yeah)
I make it hot (Make it hot)
Make it hot, make it hot
Don't stop, pop, pop, make it hot (Make it hot)
(Don't stop, pop, pop)
(Don't stop, pop, pop)
I make it hot (Make it hot)
(Don't stop, pop, pop)
Yeah, let go, J Balvin, man
Don't stop, pop, pop, make it hot

Verse 2: J Balvin
Está ahí caliente como volcán (Ey, ey)
Me tiene detrá' de ella como perro guardián (Grrr)
Está pegada, soy su fan (Wuh)
Se unió a mi equipo y me uní a su clan (Ey)
Hipnotismo como Moon y Jackie Chan, ey
Cuando twerkea ella mueve ese flan, ey
De eso tan bueno ya no dan, ey
Calla a lo Wu-Tang Clan, ey
Cuidao', te muerde mi boa
Tiro rimas como Noa (Noa)
No quiero un pedazo, te quiero to'a
¿Está' llorando? Ven y lo sobas (Uh)
'Toy activo, mami, tú me dice' when (When)
Soy de threesome, así que trae a tu friend (Ey)
Le explotó la nota cuando le dio al pen (Ey)
Él con una y yo llego con el harén

Chorus: Tyga, J Balvin & Chris Brown
I make it hot (Yeah, yeah)
Let go, J Balvin, man
Yeah, I make it hot (Make it hot)
Make it hot, make it hot
Chris Brown, Tyga
Don't stop, pop, pop, make it hot (Make it hot)
(Don't stop, pop, pop)
Latino gang yeah, yeah
(Don't stop, pop, pop)
I make it hot (Make it hot)
(Don't stop, pop, pop)
Don't stop, pop, pop, make it hot (Make it hot)

Verse 3: Chris Brown
You gon' blow my cover, baby
You gon' make me pull it up, give you that lover, lover, baby
Put my hands all on her ass, I know it's rough, baby
A lot of heat from your thighs
So I'll take my time when I'm in that
Moving right to left
I won't waste no time when I'm in that
When I'm feelin' on your spot
You gon' make it hot
You know what it is, huh
Show me what you doin' down low with your hips
I gotta tell it like it is (Huh)
Baby, you're on fire now

Chorus: Tyga & Chris Brown
I make it hot (Yeah, yeah)
I make it hot (Make it hot)
Make it hot, make it hot
Don't stop, pop, pop, make it hot (Make it hot)
(Don't stop, pop, pop)
(Don't stop, pop, pop)
I make it haute (Make it hot)
(Don't stop, pop, pop)
Don't stop, pop, pop, make it ho"
2,1PS1QMdUqOal0ai3Gt7sDQ,Gold Digger,2021-08-03T11:16:59.439Z,"Produced by Kanye West and Jon Brion

Intro: Jamie Foxx
She take my money when I'm in need
Yeah, she's a triflin' friend indeed
Oh, she's a gold digger
Way over town that digs on me

Chorus: Kanye West &amp; (Jamie Foxx)
(She give me money) Now, I ain't sayin' she a gold digger
(When I'm in need) But she ain't messin' with no broke niggas
(She give me money) Now, I ain't sayin' she a gold digger
(When I'm in need) But she ain't messin' with no broke niggas
(I gotta leave) Get down girl, go 'head, get down
(I gotta leave) Get down girl, go 'head, get down
(I gotta leave) Get down girl, go 'head, get down
(I gotta leave) Get down girl, go 'head

Verse 1: Kanye West
Cutie the bomb, met her at a beauty salon
With a baby Louis Vuitton under her underarm
She said: ""I can tell you rock, I can tell by your charm
Far as girls, you got a flock
I can tell by your charm and your arm""
But I'm lookin' for the one, have you seen her?
My psychic told me she'll have a ass like Serena
Trina, Jennifer Lopez, four kids
And I gotta take all they bad asses to ShowBiz?
Okay, get your kids, but then they got their friends
I pulled up in the Benz, they all got up in
We all went to din' and then I had to pay
If you fuckin' with this girl, then you better be paid
You know why? It take too much to touch her
From what I heard she got a baby by Busta
My best friend said she used to fuck with Usher
I don't care what none of y'all say, I still love her

Chorus: Kanye West &amp; (Jamie Foxx)
(She give me money) Now, I ain't sayin' she a gold digger
(When I'm in need) But she ain't messin' with no broke niggas
(She give me money) Now, I ain't sayin' she a gold digger
(When I'm in need) But she ain't messin' with no broke niggas
(I gotta leave) Get down girl, go 'head, get down
(I gotta leave) Get down girl, go 'head, get down
(I gotta leave) Get down girl, go 'head, get down
(I gotta leave) Get down girl, go 'head

Verse 2: Kanye West
Eighteen years, eighteen years
She got one of your kids, got you for eighteen years
I know somebody payin' child support for one of his kids
His baby mama car and crib is bigger than his
You will see him on TV any given Sunday
Win the Super Bowl and drive off in a Hyundai
She was supposed to buy your shorty Tyco with your money
She went to the doctor, got lipo with your money
She walkin' around lookin' like Michael with your money
Shoulda got that insured, Geico for your money
If you ain't no punk
Holla, ""We want prenup! We want prenup!"" (Yeah!)
It's somethin' that you need to have
‘Cause when she leave yo' ass, she gon' leave with half
Eighteen years, eighteen years
And on the 18th birthday, he found out it wasn't his?

Chorus: Kanye West &amp; (Jamie Foxx)
(She give me money) Now, I ain't sayin' she a gold digger
(When I'm in need) But she ain't messin' with no broke niggas
(She give me money) Now, I ain't sayin' she a gold digger
(When I'm in need) But she ain't messin' with no broke niggas
(I gotta leave) Get down girl, go 'head, get down
(I gotta leave) Get down girl, go 'head, get down
(I gotta leave) Get down girl, go 'head, get down
(I gotta leave) Get down girl, go 'head

Verse 3: Kanye West
Now, I ain't sayin' you a gold digger, you got needs
You don't want a dude to smoke, but he can't buy weed
You go out to eat, he can't pay, y'all can't leave
There's dishes in the back, he gotta roll up his sleeves
But while y'all washin', watch him
He gon' make it to a Benz out of that Datsun
He got that ambition, baby, look at his eyes
This week he moppin' floors, next week it's the fries
So stick by his side
I know there's dudes ballin', and yeah, that's nice
And they gonna keep callin' and tryin', but you stay right, girl
And when he get on, he'll leave yo' ass for a white girl

Chorus 2: Kanye West &amp; (Jamie Foxx)
(I gotta leave) Get down girl, go 'head, get down
(I gotta leave) Get down girl, go 'head, get down
(I gotta leave) Get down girl, go 'head, get down
(I gotta leave) Get down girl, go 'head

Outro: Kanye West
Let me hear that bac"
3,35RJhm1pEovTBwnNR0zWad,GREECE (feat. Drake),2021-08-03T03:33:19.241Z,"Intro: DJ Khaled
We The Best Music
Another one
DJ Khaled

Chorus: Drake
Come with me, leave all of your things, yeah
We can stop at Gucci, stop at Louis V, yeah
Come with me, fly you out to Greece
Full speed, survoler Paris, yeah
Come with me, leave all of your things, yeah
We can stop at Gucci, stop at Louis V, yeah
Come with me, fly you out to Greece
Full speed, survoler Paris

Verse 1: Drake
Speedboats, baby, in Nikki Beach
Waves in my ears, smokin' weed (Oui, oui)
Whippin' through the sand in a Jeep (Oui, oui)
All because of what I did on beats, baby
Life's sweet, baby, iced out, baby
You just go get ready, we go out, baby
Long time lookin' for the bounce, yeah
OZ had the bounce, yeah

Chorus: Drake
Come with me, leave all of your things, yeah
We can stop at Gucci, stop at Louis V, yeah
Come with me, fly you out to Greece
Full speed, survoler Paris
Come with me, leave all of your things, yeah
We can stop at Gucci, stop at Louis V, yeah
Come with me, fly you out to Greece
Full speed, je suis ton génie

Verse 2: Drake
Rolls Royce, baby, in Hidden Hills
Bags full of hundred dollar bills (Oui, oui)
Joggin' past your wife and she get chills (Oui, oui)
All because of how I kept it real
Life's sweet, baby, on a G-Wag
I get you anything you need, baby, yeah
Worked for everything you see, baby
Ooh-wee, baby, ooh

Chorus: Drake
Come with me, leave all of your things, yeah
We can stop at Gucci, stop at Louis V, yeah
Come with me, fly you out to Greece
Full speed, survoler Paris
Come with me, leave all of your things, yeah
We can stop at Gucci, stop at Louis V, yeah
Come with me, fly you out to Greece
Full speed, survoler Paris

Outro: Drake
(Might just have to go in on that)
Never fallin', why you makin' problems?
I've been silent, why you makin' problems?
I'm a problem, bein' rich is not my fault
You decide who you think the shit reside with
I been quiet, hard to miss me when I'm flyin'
Gone out to Caicos, she can stay in my room
She can stay in my room, and it ain't my
I was tryna play it right
I was tryna treat you nice
Funny how I had to stop
See me when I'm outside
We ain't have a problem
Then you went and found one
How you gonna get a bag?
She can't help but get attached
See me when you're outside
See me on the Southside
I could tell you're sick inside
'Cause she just wanna love me
She don't wanna leave me
She just wanna love me
She don't wanna leave m"
4,3keUgTGEoZJt0QkzTB6kHg,Truffle Butter,2021-08-03T03:29:39.523Z,"Chorus: Maya Jane Coles
You know, don't you?
Yeah
Night of
You know, don't you?
Yeah
Night of

Verse 1: Drake
Uh, thinkin' out loud
I must have a quarter million on me right now
Hard to make a song 'bout somethin' other than the money
Two things I'm about it, talkin' blunt and staying blunted
Pretty women, are you here? Are you here right now, huh?
We should all disappear right now
Look, you're gettin' all your friends and you're gettin' in the car
And you're comin' to the house, are we clear right now, huh?
You see the fleet of all the new things
Cop cars with the loose change
All white like I move things
Niggas see me rollin' and they mood change
Like a muhfucka
New flow, I got a dozen of 'em
I don't trust you, you a undercover
I could probably make some step-sisters fuck each other (Woo)
Talkin' filets with the truffle butter
Fresh sheets and towels, man she gotta love it
Yeah, they all get what they desire from it
What, tell them niggas we ain't hidin' from it

Chorus: Maya Jane Coles
You know, don't you?
Yeah
Night of
You know, don't you?
Yeah
Night of

Verse 2: Nicki Minaj
Yo, thinkin' out loud
I must have about a milli on me right now
And I ain't talkin' about that Lil Wayne record
I'm still the highest sellin' female rapper, for the record
Man, this a 65 million single sold
I ain't gotta compete with a single soul
I'm good with the ballpoint game, finger roll
Ask me how to do it, I don't tell a single soul
Pretty women, wassup? Is you here right now?
You a stand-up or is you in your chair right now?
Uhh, do you hear me? I can't let a wack nigga get near me
I might kiss the baddest bitch if you dare me
I ain't never need a man to take care of me
Yo, I'm in that big boy, bitches can't rent this
I floss everyday, but I ain't a dentist
Your whole style and approach, I invented
And I ain't takin' that back, cause I meant it

Chorus: Maya Jane Coles
You know, don't you?
Yeah
Night of
You know, don't you?
Yeah
Night of

Verse 3: Lil Wayne
Uh, thinkin' out loud
I could be broke and keep a million dollar smile
LOL to the bank, check in my account
Bank teller flirtin' after checkin' my account
Pretty ladies, are you here? Truffle butter on your pussy
Cuddle buddies on the low, you ain't gotta tell your friend
That I eat it in the morning, cause she gon' say ""I know""
Can I hit it in the bathroom? Put your hands on the toilet
I'll put one leg on the tub, girl, this my new dance move
I just don't know what to call it
But, bitch, you dancing with the stars
I ain't nothin' like your last dude
What's his name? — Not important
I brought some cocaine if you snortin'
She became a vacuum, put it on my dick like carpet
Suck the white off, white chocolate
I'm so heartless, thoughtless, lawless, and flawless
Smallest, regardless, largest in charge
And born in New Orleans, get killed for Jordans
Skateboard, I'm gnarly, Drake, Tunechi, and Barbie
You know!

Chorus: Maya Jane Coles
You know, don't you?
Yeah
Night of
You know, don't you?
Yeah
Night o"
5,7nBnxipTxl27eJa9ltaikO,Dem Jeans,2021-08-03T03:19:07.391Z,"Intro: Chingy & JD
You already know, ha-ha, Slot-a-lot, SoSoDef
And if you're a bad chick get on the floor and....
How the, hell did you get all of that in dem jeans?
(Bounce, bounce, bounce)
How the how the hell did you get all of that in dem jeans?
(If you're a bad chick get on the floor and bounce)
Cause your waist so little and your ass is like whoa
(Yeah I know what this is, SoSoDef!)
Cause your waist so little and your ass is like whoa

Verse 1: Chingy
Prada, Gucci, tell me what you like?
Coach bag with the shoes to match, forget the price
Marc Jacob shades, 50 karats all ice
Model in dem jeans for me, luxury, now that's your life
That's the type of shit I'm on
Let me see you get them on
Back it up a bit, yeah that's it, cause I can see your thong
Caramel skin tone
Damn, you look like Nia Long
Don't be acting like that lil' mama, cause I can leave you 'lone
Mix the lime with that Patron
That's what we drinking on
She wanna go out to eat, but me, JD, I'm thinkin' home
Just so I can see 'em off
But what the hell we both grown
Wearin' dem jean like that will make me take trips with you to Rome

Pre-Hook 1: Chingy
Hey now (hey, hey), hey now (hey)
You know they thick from the STL to the A-Now
Hey now (Hey, hey), hey now (hey)
Let me help you with dem jeans, baby, lay down

Hook: Chingy
Damn girl
How'd you get all that in
Dem Jeans, dem Jeans?
How'd you get all that in Dem?
Damn girl
How'd you get all that?
(Is you talking to me?)
Yeah, you
I bet you had to jump up and down just to put 'em on
Bet you had to wiggle it around just to put 'em on
Bet you had to lay back on the be just to zip 'em up
Am I right?
(You right)
Baby that's what's up

JD
Now. Now. Now
When walkin' girl
And you make it swirl
It's hard for me not to look and I want you in my world
Bubbled up (Oh)
Poking out (Hey)
Lickin' my lip saying, shawty swing it my way
Damn, Ma, damn, Ma
How the hell you get all that in dem pants ma
Hope you ain't up in here with your man ma
I love it when you wiggle it, shake it
Drop it, and do your little dance
True Religion, 7's or dem rocking Republics
Or the ones that fit the best and show it just how we love it
Know just how to hug it
Know just how to cuff it
When you walk away it make me wanna rub and say

Pre-Hook 2: Chingy & JD
Hey now (hey, hey), hey now (hey)
You know they thick from the ATL to the H-Town
I'm saying, hey now (hey, hey), hey now (hey)
Let me help you with dem jeans, baby, lay down
Come on

Hook: Chingy
Damn girl
How'd you get all that in
Dem Jeans, dem Jeans?
How'd you get all that in Dem?
Damn girl
How'd you get all that?
(Is you talking to me?)
Yeah, you
I bet you had to jump up and down just to put 'em on
Bet you had to wiggle it around just to put 'em on
Bet you had to lay back on the be just to zip 'em up
Am I right?
(You right)
Baby that's what's up

Verse 3: Chingy
I don't mean to be rude
But I like the way you move
Got your boy in the mood
Let's go back to my jacuzz'
I ain't like them other fools
Got to play by my rules
Face down, ass up, pants off, look (ooh)
There it go, don't be scared
Let it show it, like them curves
Make that thing talk, when you walk, I'm slurring my words
Drop it to the floor, ya heard
Ain't no hating girl, ya hot
Like the style but man you working them a lot

Hook: Chingy
Damn girl
How'd you get all that in
Dem Jeans, dem Jeans?
How'd you get all that in Dem?
Damn girl
How'd you get all that?
(Is you talking to me?)
Yeah, you
I bet you had to jump up and down just to put 'em on
Bet you had to wiggle it around just to put 'em on
Bet you had to lay back on the be just to zip 'em up
Am I right?
(You right)
Baby that's what's u"
6,7fBv7CLKzipRk6EC6TWHOB,The Hills,2021-08-03T03:19:04.736Z,"Intro
Yeah
Yeah
Yeah

Verse 1
Your man on the road, he doin' promo
You said, ""Keep our business on the low-low""
I'm just tryna get you out the friend zone
'Cause you look even better than the photos
I can't find your house, send me the info
Drivin' through the gated residential
Found out I was comin', sent your friends home
Keep on tryna hide it, but your friends know

Chorus
I only call you when it's half-past five
The only time that I'll be by your side
I only love it when you touch me, not feel me
When I'm fucked up, that's the real me
When I'm fucked up, that's the real me, yeah
I only call you when it's half-past five
The only time I'd ever call you mine
I only love it when you touch me, not feel me
When I'm fucked up, that's the real me
When I'm fucked up, that's the real me, babe

Verse 2
I'ma let you know and keep it simple
Tryna keep it up don't seem so simple
I just fucked two bitches 'fore I saw you
And you gon' have to do it at my tempo
Always tryna send me off to rehab
Drugs started feelin' like it's decaf
I'm just tryna live life for the moment
And all these motherfuckers want a relapse

Chorus
I only call you when it's half-past five
The only time that I'll be by your side
I only love it when you touch me, not feel me
When I'm fucked up, that's the real me
When I'm fucked up, that's the real me, yeah
I only call you when it's half-past five
The only time I'd ever call you mine
I only love it when you touch me, not feel me
When I'm fucked up, that's the real me
When I'm fucked up, that's the real me, babe

Bridge
Hills have eyes, the hills have eyes
Who are you to judge? Who are you to judge?
Hide your lies, girl, hide your lies (Hide your lies, oh, baby)
Only you to trust, only you

Chorus
I only call you when it's half-past five
The only time that I'll be by your side
I only love it when you touch me, not feel me
When I'm fucked up, that's the real me
When I'm fucked up, that's the real me, yeah
I only call you when it's half-past five
The only time I'd ever call you mine
I only love it when you touch me, not feel me
When I'm fucked up, that's the real me
When I'm fucked up, that's the real me, babe

Outro
Ewedihalehu
Yene konjo, ewedihalehu
Yene fikir, fikir, fikir, fikir
Yene fikir, fikir, fikir, fikir
Ewedihalehu
Yene konjo, ewedihalehu.."
7,2iDjCLUOGhJtz5cPHljGVd,Ass Drop,2021-08-03T03:19:03.395Z,"Verse 1
Goddamn, Goddamn
How the hell you get all that ass in them pants?
How you drinkin' and you ain't got no glass?
And how you came in here and you ain't got no man, what
Damn, to me you look perfect
Bend that ass over; let me see how you work it
Poppin' and shakin', get on your knees hit the dirt
Girl I go so deep in that pussy while he just hitting the surface
What is you sayin'?

Hook
Drop it down on it
Made me get a couple bands drop it down on it
Make you get a couple friends drop it down on it
Turn around drop it down, drop it down on it
Do it for a real nigga, do it for a boss
Do somethin' for a boss, do somethin' for a real nigga
Go and do somethin' for a boss
Do somethin' for a boss, do somethin'

Verse 2
You got a ass make a nigga wanna buy a ring
You got a ass make a nigga spend errything
You got a ass make a nigga wanna buy a ring
You got a ass make a nigga spend errything
If you've got an ass like the girls in the videos
Go and bring it my way
Ass so big it could swallow up a stripper pole
I ain't playin', no I ain't playin'
Bust it down on me, I need it, throw it, a boss wanna see it
Just give me a call and I'll beat it
I'll be all where your seat is
Mary Jane got me moving slow
I blow that by the (O, O, O, O...)
Uh

Hook
Drop it down on it
Made me get a couple bands drop it down on it
Make you get a couple friends drop it down on it
Turn around drop it down, drop it down on it
Do it for a real nigga, do it for a boss
Do somethin' for a boss, do somethin' for a real nigga
Go and do somethin' for a boss
Do somethin' for a boss, do somethin'

Bridge
Got a fat ass
Go on and shake that shit
Got a fat ass
Go on and shake that shit
Whoa
Got a fat ass
Go on and shake that shit
You got a fat ass
Go on and shake that shit
Damn

Hook
Drop it down on it
Made me get a couple bands drop it down on it
Make you get a couple friends drop it down on it
Turn around drop it down, drop it down on it
Do it for a real nigga, do it for a boss
Do somethin' for a boss, do somethin' for a real nigga
Go and do somethin' for a boss
Do somethin' for a boss, do somethin"
