,song_id,song_name,date_time_played,lyrics
8,2ab4xGVMBb14NpPrj4xDq5,Money Mouf,2021-08-03T03:19:00.417Z,"Pre-Chorus: Tyga
One, two racks, I'ma blow that (Yeah, yeah)
Three, four, five, I'ma hold that ($K, yeah, yeah)
Six, seven, eight, I'ma show that (Show that)
Nine, ten racks, I'ma throw that (OG Parker, go, woo)

Chorus: Tyga
Ayy, bounce that ass, yeah, throw it back (Throw it back)
Spend that cash, you got hella racks (Hella racks)
Run that bag, nigga, no cap (No cap)
Put your money where your motherfuckin' mouth at (Mouth at)
Ayy, is you 'bout that?
Put your money where your motherfuckin' mouth at (Mouth at)
Ayy, is you 'bout that?
Put your money where your motherfuckin' mouth

Verse 1: Tyga
What's up, lil' bitch? I invented racks (Rack city)
Where the Brinks truck? bitch, unload that (Skrrt, skrrt)
Bitch, I'm a king like a planned sack (Boss)
The bitch tried to play me, I'ma play her back (Bitch, yeah)
Bitch hoppin' on my dick like a jumping jack (Woah, woah)
I'ma pay for hеr ass, I don't like it flat (No)
I invest in you, I'ma get thе money back (Yeah)
You know I got the Midas touch, ta-da-da (Yeah)
I know you wanna fuck a rapper, fuck an athlete (Yeah, yeah)
Runnin' to the studio like a track meet (Run it, baby)
And I need a fat ass, it's a Black thing (Big fat)
Got a Chinese bitch, it's a ling-ling, hah (Wah)

Pre-Chorus: Tyga
One, two racks, I'ma blow that (Yeah)
Three, four, five, I'ma hold that (Hold that)
Six, seven, eight, I'ma show that (Show that)
Nine, ten racks, I'ma throw that (Go, woo)

Chorus: Tyga
Ayy, bounce that ass, yeah, throw it back (Throw it back)
Spend that cash, you got hella racks (Hella racks)
Run that bag, nigga, no cap (No cap)
Put your money where your motherfuckin' mouth at (Mouth at)
Ayy, is you 'bout that?
Put your money where your motherfuckin' mouth at
Ayy, is you 'bout that?
Put your money where your motherfuckin' mouth

Verse 2: Saweetie
Yeah
When I'm coutin', I don't wanna speak (Uh-uh)
Runnin' games like seven days, man this nigga weak (Boy, bye)
Ooh, I love sloppy toppy, but my Henny neat (Mwah)
Got the hottest nigga in the A between my sheets (Palms itchin', palms itchin')
You know Saweetie bad bitchin'
Triple-plat' pussy, so you know it hit different (Pah-pah-pah)
Big crib, peep how your baby livin'
If a nigga broke in, I wouldn't notice shit missin'
A bitch mad in the mirror 'cause she ain't me (Ain't me)
Girl, I passed on your man, you should thank me (Better thank me)
I'ma cold lil' piece, they should paint me (Hahaha)
If I ran from the bank, it'd chase me (Vroom)

Pre-Chorus: Saweetie
One, two racks, I don't want that (Mmm-mmm)
Three, four racks, I'd pour that (Yeah)
Five, six, shit, I might hold that (What?)
Cashin' out on ones and throw that (Bitch)

Chorus: Tyga
Ayy, bounce that ass, yeah, throw it back (Throw it back)
Spend that cash, you got hella racks (Hella racks)
Run that bag, nigga, no cap (No cap)
Put your money where your motherfuckin' mouth at (Mouth at)
Ayy, is you 'bout that?
Put your money where your motherfuckin' mouth at (Mouth at)
Ayy, is you 'bout that?
Put your money where your motherfuckin' mouth

Verse 3: YG & Saweetie
All that ass in those jeans
I'm tryna get between
She ain't happy at home
That's how his lil' bitch got stole
Me and T in matchin' lines, we gon' fuck it up (Fuck it up, sis)
Do the gingerbread man, we gon' run it up  (Run it up, sis)
Got a natural lil' thang and she bad as fuck (Yeah, she bad)
She gon' hit the gym, fuck a tummy tuck (Fuck)
Fuck your ex-nigga, fuck your next nigga (Ayy)
I'm your right now nigga, I'm your best nigga (I'm your best nigga)
I wanna pay for everything and have sex with you
Your old thang told you no, I'm your yes nigga (Yes)

Pre-Chorus: Tyga
One, two racks, I'ma blow that (Yeah, yeah)
Three, four, five, I'ma hold that (Hold that)
Six, seven, eight, I'ma show that (Show that)
Nine, ten, racks, I'ma throw that (Go)

Chorus: Tyga
Ayy, bounce that ass, yeah, throw it back (Throw it back)
Spend that cash, you got hella racks (Hella racks)
Run that bag, nigga, no cap (No cap)
Put your money where your motherfuckin' mouth at (Mouth at)
Ayy, is you 'bout that?
Put your money where your motherfuckin' mouth at
Ayy, is you 'bout that?
Put your money where your motherfuckin' mouth (Haha"
9,7rC5Pl8rQSX4myONQHYPBK,Mob Ties,2021-08-03T03:18:56.757Z,"Verse 1
Ayy, sick of these niggas (Sick)
Sick of these niggas (Sick, sick)
Hire some help (Help), get rid of these niggas (Skrr)
Sick of this shit, move to the Ritz
Turned out the bitch (Ayy)
It is what it is, yeah
GLE, 'cause that Lambo movin' fast (Skrr)
S Class, G Class, lotta class (Sss, sss)
In a rocket and that bitch ain't got no tags (Skrr, skrr)
Louis bags in exchange for body bags, yeah

Pre-Chorus
Sick of these niggas (Sick)
Sick of these niggas (Sick, sick)
Hire some help (Help), get rid of these niggas (Grr)
Fuck what it was, it is what it is (What)
Whatever you did, it is what it is

Chorus
And I'm so tired (tired)
I fuck with the mob and I got ties (Lotta ties, lotta ties)
Knock you off to pay their tithes (Do doo)
They want me gone but don't know why
It's too late for all that lovey-dovey shit
I'm your brother shit, all that other shit
It's too late for all that
It's too late for all that, ayy
It's too late for all that lovey-dovey shit
I'm your brother shit, all that other shit
It's too late for all that, ayy
It's too late for all that

Post-Chorus
Ayy, sick of these niggas
I'm sick of these niggas
Hire some help, get rid of these niggas
I'm not with the ra-ra
I am a Dada
My bitch in Chanel now
Your bitch in Escada (Sick, sick, sick, sick)

Verse 2
Yeah, and they shook
Please don't let them fool ya, I don't care how they look (Nah)
Heard all of the talkin', now it's quiet, now it's shush (Shh)
Twenty-nine is comin', they on edge when I cook (Cook)
Lead the league in scorin', man, but look at my assists (Shh)
Yes I be with Future but I like to reminisce (Yeah)
I do not forget a thing, I'm patient, it's a gift (yeah)
Try to tell 'em they ain't got to do it, they insist (they insist)
Yeah, I can tell
I just gave 'em two for forty million like Chappelle (Two)
Standin' over coffin with a hammer and a nail (Two)
Heard you hit up so and so, that name don't ring a bell, nah

Pre-Chorus
Sick of these niggas (Sick)
Hire some help, get rid of these niggas
I'm sick of this shit (Sick, sick)
I'm runnin' a blitz (Ayy)
Whatever you did (Ayy), it is what it is

Chorus
And I'm so tired (Tired)
I fuck with the mob and I got ties (Lotta ties, lotta ties)
Knock you off to pay their tithes (Do doo)
They want me gone but don't know why
It's too late for all that lovey-dovey shit
I'm your brother shit, all that other shit
It's too late for all that
It's too late for all that, ayy
It's too late for all that lovey-dovey shit
I'm your brother shit, all that other shit
It's too late for all that, ayy
It's too late for all tha"
10,5o1KVkvyE9yDbNk9PiTjui,Licht & Farben,2021-08-03T03:08:02.757Z,"Couldn't get lyrics for Licht & Farben by S.Y.N.O..
"
11,3PygOTzzolVCIZKUIvhgNS,Quarantine - Original,2021-08-03T01:30:30.312Z,"Couldn't get lyrics for Quarantine - Original by Ante Perry.
"
12,1Y5RcVWFfYgGBxeGfPuvcL,Krambambuli,2021-08-03T01:30:29.141Z,"Couldn't get lyrics for Krambambuli by Animal Trainer.
"
13,6dsoPBbMuUodSUvhRW7Vr4,Alone (feat. FEMME),2021-08-03T01:30:26.944Z,"Couldn't get lyrics for Alone (feat. FEMME) by Cristoph.
"
14,3VlI1pqUIImhR95sUf1Lm5,Muerte,2021-08-03T01:30:24.743Z,"Couldn't get lyrics for Muerte by Teenage Mutants.
"
15,55ihXQCQPXmW8SAHfbjFIQ,Eclipse,2021-08-03T01:30:22.979Z,"Couldn't get lyrics for Eclipse by Tim Green.
"
16,4cqJcz478tI3VSIBhWQ8ok,I'm Still Here - Winnie & Somow Remix,2021-08-03T01:30:21.350Z,"Couldn't get lyrics for I'm Still Here - Winnie & Somow Remix by Jazzanova.
"
17,5PKuIVDnWbTyPwxz5dM9yL,The Ride,2021-08-03T01:30:20.012Z,"Couldn't get lyrics for The Ride by Chris Luno.
"
18,7AiU9qygT8WPKhrFExXJpq,Shakti Pan,2021-08-03T01:30:18.378Z,"Couldn't get lyrics for Shakti Pan by Kellerkind.
"
19,4G3JuXNXKdolUhboh2wKJo,Punxsutawney,2021-08-03T01:30:16.849Z,"Couldn't get lyrics for Punxsutawney by Pan-Pot.
"
20,7hYy4nTXqpUhEbRNwAGlf7,Soma,2021-08-03T01:30:13.926Z,"Couldn't get lyrics for Soma by Return Of The Jaded.
"
21,5pzAsNs6JC3TcKQYRhH8m0,The Thrill,2021-08-03T00:58:03.042Z,"Couldn't get lyrics for The Thrill by Dayne S.
"
22,031AIGrfnhZYJxegTuYw9W,Kackvogel - Original Mix,2021-08-02T23:47:41.640Z,Instrumenta
23,3fFOibIbaNLLmVnZA6hOhu,Cotton Fields - Radio Mix,2021-08-02T23:47:40.755Z,"Couldn't get lyrics for Cotton Fields - Radio Mix by Sons Of Maria.
"
24,1LbAal2tZEWVedJgFqqg5Q,Rave,2021-08-02T23:47:39.523Z,"Couldn't get lyrics for Rave by MEZERG.
"
